{
  "$schema": "../../schema/classifications.schema.json",
  "schemaVersion": 1,
  "species": "dog",
  "taxonomies": [
    {
      "id": "dog:akc-breed-classification",
      "name": "AKC Breed Classification",
      "version": "2026-10-13",
      "authority": {
        "id": "akc",
        "name": "American Kennel Club",
        "url": "https://www.akc.org/"
      },
      "status": "current",
      "provenance": [
        {
          "source": "American Kennel Club",
          "url": "https://www.akc.org/dog-breeds/",
          "retrievedAt": "2026-10-13",
          "note": "Seven recognized breed groups plus the Miscellaneous Class and Foundation Stock Service program."
        }
      ]
    }
  ],
  "categories": [
    {
      "id": "dog:akc-breed-classification:foundation-stock-service",
      "taxonomyId": "dog:akc-breed-classification",
      "name": "Foundation Stock Service",
      "slug": "foundation-stock-service",
      "categoryType": "program",
      "status": "current",
      "provenance": [
        {
          "source": "American Kennel Club",
          "url": "https://www.akc.org/dog-breeds/foundation-stock-service/",
          "retrievedAt": "2026-10-13"
        }
      ]
    },
    {
      "id": "dog:akc-breed-classification:herding",
      "taxonomyId": "dog:akc-breed-classification",
      "name": "Herding Group",
      "slug": "herding",
      "categoryType": "group",
      "status": "current",
      "provenance": [
        {
          "source": "American Kennel Club",
          "url": "https://www.akc.org/dog-breeds/herding/",
          "retrievedAt": "2026-10-13"
        }
      ]
    },
    {
      "id": "dog:akc-breed-classification:hound",
      "taxonomyId": "dog:akc-breed-classification",
      "name": "Hound Group",
      "slug": "hound",
      "categoryType": "group",
      "status": "current",
      "provenance": [
        {
          "source": "American Kennel Club",
          "url": "https://www.akc.org/dog-breeds/hound/",
          "retrievedAt": "2026-10-13"
        }
      ]
    },
    {
      "id": "dog:akc-breed-classification:miscellaneous-class",
      "taxonomyId": "dog:akc-breed-classification",
      "name": "Miscellaneous Class",
      "slug": "miscellaneous-class",
      "categoryType": "class",
      "status": "current",
      "provenance": [
        {
          "source": "American Kennel Club",
          "url": "https://www.akc.org/dog-breeds/miscellaneous-class/",
          "retrievedAt": "2026-10-13"
        }
      ]
    },
    {
      "id": "dog:akc-breed-classification:non-sporting",
      "taxonomyId": "dog:akc-breed-classification",
      "name": "Non-Sporting Group",
      "slug": "non-sporting",
      "categoryType": "group",
      "status": "current",
      "provenance": [
        {
          "source": "American Kennel Club",
          "url": "https://www.akc.org/dog-breeds/non-sporting/",
          "retrievedAt": "2026-10-13"
        }
      ]
    },
    {
      "id": "dog:akc-breed-classification:sporting",
      "taxonomyId": "dog:akc-breed-classification",
      "name": "Sporting Group",
      "slug": "sporting",
      "categoryType": "group",
      "status": "current",
      "provenance": [
        {
          "source": "American Kennel Club",
          "url": "https://www.akc.org/dog-breeds/sporting/",
          "retrievedAt": "2026-10-13"
        }
      ]
    },
    {
      "id": "dog:akc-breed-classification:terrier",
      "taxonomyId": "dog:akc-breed-classification",
      "name": "Terrier Group",
      "slug": "terrier",
      "categoryType": "group",
      "status": "current",
      "provenance": [
        {
          "source": "American Kennel Club",
          "url": "https://www.akc.org/dog-breeds/terrier/",
          "retrievedAt": "2026-10-13"
        }
      ]
    },
    {
      "id": "dog:akc-breed-classification:toy",
      "taxonomyId": "dog:akc-breed-classification",
      "name": "Toy Group",
      "slug": "toy",
      "categoryType": "group",
      "status": "current",
      "provenance": [
        {
          "source": "American Kennel Club",
          "url": "https://www.akc.org/dog-breeds/toy/",
          "retrievedAt": "2026-10-13"
        }
      ]
    },
    {
      "id": "dog:akc-breed-classification:working",
      "taxonomyId": "dog:akc-breed-classification",
      "name": "Working Group",
      "slug": "working",
      "categoryType": "group",
      "status": "current",
      "provenance": [
        {
          "source": "American Kennel Club",
          "url": "https://www.akc.org/dog-breeds/working/",
          "retrievedAt": "2026-10-13"
        }
      ]
    }
  ],
  "memberships": [
    {
      "breedId": "dog:affenpinscher",
      "taxonomyId": "dog:akc-breed-classification",
      "categoryId": "dog:akc-breed-classification:toy",
      "status": "current",
      "provenance": [
        {
          "source": "American Kennel Club",
          "url": "https://www.akc.org/dog-breeds/toy/",
          "reference": "AKC breed ID 23195",
          "retrievedAt": "2026-10-13"
        }
      ]
    },
    {
      "breedId": "dog:afghan-hound",
      "taxonomyId": "dog:akc-breed-classification",
      "categoryId": "dog:akc-breed-classification:hound",
      "status": "current",
      "provenance": [
        {
          "source": "American Kennel Club",
          "url": "https://www.akc.org/dog-breeds/hound/",
          "reference": "AKC breed ID 23209",
          "retrievedAt": "2026-10-13"
        }
      ]
    },
    {
      "breedId": "dog:airedale-terrier",
      "taxonomyId": "dog:akc-breed-classification",
      "categoryId": "dog:akc-breed-classification:terrier",
      "status": "current",
      "provenance": [
        {
          "source": "American Kennel Club",
          "url": "https://www.akc.org/dog-breeds/terrier/",
          "reference": "AKC breed ID 23224",
          "retrievedAt": "2026-10-13"
        }
      ]
    },
    {
      "breedId": "dog:akita",
      "taxonomyId": "dog:akc-breed-classification",
      "categoryId": "dog:akc-breed-classification:miscellaneous-class",
      "status": "pending-recognition",
      "provenance": [
        {
          "source": "American Kennel Club",
          "url": "https://www.akc.org/dog-breeds/miscellaneous-class/",
          "reference": "AKC breed ID 116964",
          "retrievedAt": "2026-10-13"
        }
      ]
    },
    {
      "breedId": "dog:akita",
      "taxonomyId": "dog:akc-breed-classification",
      "categoryId": "dog:akc-breed-classification:working",
      "status": "current",
      "provenance": [
        {
          "source": "American Kennel Club",
          "url": "https://www.akc.org/dog-breeds/working/",
          "reference": "AKC breed ID 23239",
          "retrievedAt": "2026-10-13"
        }
      ]
    },
    {
      "breedId": "dog:alaskan-klee-kai",
      "taxonomyId": "dog:akc-breed-classification",
      "categoryId": "dog:akc-breed-classification:miscellaneous-class",
      "status": "pending-recognition",
      "provenance": [
        {
          "source": "American Kennel Club",
          "url": "https://www.akc.org/dog-breeds/miscellaneous-class/",
          "reference": "AKC breed ID 121466",
          "retrievedAt": "2026-10-13"
        }
      ]
    },
    {
      "breedId": "dog:alaskan-malamute",
      "taxonomyId": "dog:akc-breed-classification",
      "categoryId": "dog:akc-breed-classification:working",
      "status": "current",
      "provenance": [
        {
          "source": "American Kennel Club",
          "url": "https://www.akc.org/dog-breeds/working/",
          "reference": "AKC breed ID 23249",
          "retrievedAt": "2026-10-13"
        }
      ]
    },
    {
      "breedId": "dog:american-bulldog",
      "taxonomyId": "dog:akc-breed-classification",
      "categoryId": "dog:akc-breed-classification:foundation-stock-service",
      "status": "pending-recognition",
      "provenance": [
        {
          "source": "American Kennel Club",
          "url": "https://www.akc.org/dog-breeds/foundation-stock-service/",
          "reference": "AKC breed ID 96298",
          "retrievedAt": "2026-10-13"
        }
      ]
    },
    {
      "breedId": "dog:american-english-coonhound",
      "taxonomyId": "dog:akc-breed-classification",
      "categoryId": "dog:akc-breed-classification:hound",
      "status": "current",
      "provenance": [
        {
          "source": "American Kennel Club",
          "url": "https://www.akc.org/dog-breeds/hound/",
          "reference": "AKC breed ID 23264",
          "retrievedAt": "2026-10-13"
        }
      ]
    },
    {
      "breedId": "dog:american-eskimo-dog",
      "taxonomyId": "dog:akc-breed-classification",
      "categoryId": "dog:akc-breed-classification:non-sporting",
      "status": "current",
      "provenance": [
        {
          "source": "American Kennel Club",
          "url": "https://www.akc.org/dog-breeds/non-sporting/",
          "reference": "AKC breed ID 23278",
          "retrievedAt": "2026-10-13"
        }
      ]
    },
    {
      "breedId": "dog:american-foxhound",
      "taxonomyId": "dog:akc-breed-classification",
      "categoryId": "dog:akc-breed-classification:hound",
      "status": "current",
      "provenance": [
        {
          "source": "American Kennel Club",
          "url": "https://www.akc.org/dog-breeds/hound/",
          "reference": "AKC breed ID 23292",
          "retrievedAt": "2026-10-13"
        }
      ]
    },
    {
      "breedId": "dog:american-hairless-terrier",
      "taxonomyId": "dog:akc-breed-classification",
      "categoryId": "dog:akc-breed-classification:terrier",
      "status": "current",
      "provenance": [
        {
          "source": "American Kennel Club",
          "url": "https://www.akc.org/dog-breeds/terrier/",
          "reference": "AKC breed ID 23307",
          "retrievedAt": "2026-10-13"
        }
      ]
    },
    {
      "breedId": "dog:american-leopard-hound",